{
  "$schema": "https://json-schema.org/draft/2020-12/schema",
  "$id": "https://kenoodl.com/x402-metrics/x402-metrics.schema.json",
  "title": "x402 seller metrics v0.1",
  "description": "Honest per-seller reporting standard for x402 services. Published at /.well-known/x402-metrics.json. All counts are for the declared window unless a field says otherwise.",
  "type": "object",
  "required": [
    "spec_version",
    "generated_at",
    "seller",
    "protocol",
    "window",
    "endpoints",
    "totals",
    "declared_exclusions",
    "receipt_linkage"
  ],
  "additionalProperties": false,
  "properties": {
    "spec_version": {
      "type": "string",
      "const": "0.1",
      "description": "REQUIRED. Version of this spec the document conforms to."
    },
    "generated_at": {
      "type": "string",
      "format": "date-time",
      "description": "REQUIRED. ISO 8601 timestamp when this report was generated. Maps Utilia generatedAt."
    },
    "seller": {
      "type": "object",
      "required": [
        "name"
      ],
      "additionalProperties": false,
      "properties": {
        "name": {
          "type": "string",
          "minLength": 1,
          "description": "REQUIRED. Seller name as listed publicly."
        },
        "url": {
          "type": "string",
          "description": "OPTIONAL. Seller site or listing URL."
        }
      }
    },
    "protocol": {
      "type": "string",
      "minLength": 1,
      "description": "REQUIRED. Payment protocol and version, e.g. \"x402/v2\".",
      "examples": [
        "x402/v2"
      ]
    },
    "window": {
      "type": "object",
      "required": [
        "start",
        "end",
        "hours"
      ],
      "additionalProperties": false,
      "description": "REQUIRED. The reporting window. Explicit start and end, no assumed period. Monthly is the recommended cadence but any window is valid if declared.",
      "properties": {
        "start": {
          "type": "string",
          "format": "date-time",
          "description": "REQUIRED. Window start, inclusive, ISO 8601."
        },
        "end": {
          "type": "string",
          "format": "date-time",
          "description": "REQUIRED. Window end, exclusive, ISO 8601. Must be after start."
        },
        "hours": {
          "type": "number",
          "exclusiveMinimum": 0,
          "description": "REQUIRED. Window duration in hours. Must equal (end - start). Maps Utilia windowHours."
        }
      }
    },
    "endpoints": {
      "type": "array",
      "minItems": 1,
      "description": "REQUIRED. One row per paid endpoint. An array, never a map keyed by URL, so aggregation across sellers is trivial.",
      "items": {
        "$ref": "#/$defs/endpoint_row"
      }
    },
    "totals": {
      "$ref": "#/$defs/totals_block"
    },
    "declared_exclusions": {
      "type": "array",
      "description": "REQUIRED, may be empty. Wallets the seller controls or has arrangements with, declared by address. Payments from these addresses are excluded from unique_payers, repeat_payers, and revenue_usdc_net_of_own_wallets, and are classified by source_class in the breakdowns. An empty array is a positive claim: no such wallets exist.",
      "items": {
        "$ref": "#/$defs/exclusion"
      }
    },
    "receipt_linkage": {
      "$ref": "#/$defs/receipt_linkage"
    },
    "notes": {
      "type": "string",
      "description": "OPTIONAL. Free text: methodology caveats, price history, anything a reader needs to interpret the numbers honestly."
    },
    "extensions": {
      "type": "object",
      "description": "OPTIONAL. Namespaced extra data. Anything not in the core spec goes here, never as new top-level fields."
    }
  },
  "$defs": {
    "evm_address": {
      "type": "string",
      "pattern": "^0x[0-9a-fA-F]{40}$",
      "description": "EVM address, 0x plus 40 hex chars."
    },
    "tx_hash": {
      "type": "string",
      "pattern": "^0x[0-9a-fA-F]{64}$",
      "description": "Transaction hash, 0x plus 64 hex chars."
    },
    "count": {
      "type": "integer",
      "minimum": 0
    },
    "source_class": {
      "type": "string",
      "enum": [
        "organic",
        "verifier",
        "prearranged",
        "self",
        "scanner",
        "unknown"
      ],
      "description": "organic: a real outside buyer consuming the output. verifier: pays to confirm the endpoint works, not to consume the output (registry crawlers settling to confirm liveness, directory validators, health checks, probes). prearranged: known integration or fixture wallet, payment agreed in advance. self: a wallet the seller controls. scanner: automated discovery traffic, typically hits challenges but rarely pays. unknown: the seller could not classify with confidence. unknown is legitimate, not a failure state."
    },
    "source_class_breakdown": {
      "type": "object",
      "required": [
        "organic",
        "verifier",
        "prearranged",
        "self",
        "scanner",
        "unknown"
      ],
      "additionalProperties": false,
      "description": "Counts by source_class. All six keys required so zeros are explicit and aggregation is trivial. Must sum to the metric it breaks down.",
      "properties": {
        "organic": {
          "$ref": "#/$defs/count"
        },
        "verifier": {
          "$ref": "#/$defs/count"
        },
        "prearranged": {
          "$ref": "#/$defs/count"
        },
        "self": {
          "$ref": "#/$defs/count"
        },
        "scanner": {
          "$ref": "#/$defs/count"
        },
        "unknown": {
          "$ref": "#/$defs/count"
        }
      }
    },
    "abandonment_causes": {
      "type": "object",
      "required": [
        "funding",
        "policy",
        "retry_handling",
        "receipt_handling",
        "unknown"
      ],
      "additionalProperties": false,
      "description": "Counts of abandoned challenges by cause. funding: buyer wallet empty or unfunded. policy: spend limit, allowlist, or human-approval gate blocked the payment. retry_handling: the buyer runtime could not construct or send the signed retry. receipt_handling: it paid or could have paid but could not process what came back. unknown: no evidence either way, the honest default. All keys required so zeros are explicit.",
      "properties": {
        "funding": {
          "$ref": "#/$defs/count"
        },
        "policy": {
          "$ref": "#/$defs/count"
        },
        "retry_handling": {
          "$ref": "#/$defs/count"
        },
        "receipt_handling": {
          "$ref": "#/$defs/count"
        },
        "unknown": {
          "$ref": "#/$defs/count"
        }
      }
    },
    "failure_class": {
      "type": "string",
      "enum": [
        "upstream_timeout",
        "upstream_error",
        "settlement_verified_but_no_delivery",
        "malformed_payment",
        "insufficient_amount",
        "replay_rejected",
        "rate_limited",
        "sandbox_failure",
        "other"
      ]
    },
    "paid_retry_failures": {
      "type": "object",
      "required": [
        "total",
        "by_class"
      ],
      "additionalProperties": false,
      "description": "REQUIRED. Counts the case where a buyer paid, retried with the payment signature, and still did not get what they paid for. by_class must sum to total. Maps Utilia paidRetryFailuresByClass.",
      "properties": {
        "total": {
          "$ref": "#/$defs/count"
        },
        "by_class": {
          "type": "array",
          "description": "One entry per failure class observed. Empty array when total is 0. No duplicate classes.",
          "items": {
            "type": "object",
            "required": [
              "class",
              "count"
            ],
            "additionalProperties": false,
            "properties": {
              "class": {
                "$ref": "#/$defs/failure_class"
              },
              "count": {
                "type": "integer",
                "minimum": 1
              },
              "note": {
                "type": "string",
                "minLength": 1,
                "description": "REQUIRED when class is \"other\", so other cannot become a dumping ground. OPTIONAL for every other class."
              }
            },
            "if": {
              "properties": {
                "class": {
                  "const": "other"
                }
              }
            },
            "then": {
              "required": [
                "class",
                "count",
                "note"
              ]
            }
          }
        }
      }
    },
    "core_metrics": {
      "type": "object",
      "required": [
        "challenges_served",
        "challenges_abandoned",
        "paid_calls",
        "unique_payers",
        "repeat_payers",
        "revenue_usdc_net_of_own_wallets",
        "paid_retry_failures"
      ],
      "properties": {
        "challenges_served": {
          "$ref": "#/$defs/count",
          "description": "REQUIRED. Number of 402 challenge responses served in the window. Maps Utilia challenges."
        },
        "paid_calls": {
          "$ref": "#/$defs/count",
          "description": "REQUIRED. Number of calls with a settled payment in the window, all sources included. Maps Utilia settlements."
        },
        "challenges_abandoned": {
          "type": [
            "integer",
            "null"
          ],
          "minimum": 0,
          "description": "REQUIRED, nullable. Challenges served that never produced a payment attempt: no retry carrying a payment signature was observed from that client within the window. This is the largest drop-off on the rail and the least published. If you cannot attribute retries to challenges, report null. Never guess."
        },
        "payment_attempts": {
          "$ref": "#/$defs/count",
          "description": "OPTIONAL. Retries that arrived carrying a payment signature, whether or not they settled or delivered. The middle of the funnel: challenges_served minus payment_attempts approximates abandonment, payment_attempts minus paid_calls approximates failure. Maps Utilia paidRetryAttempts."
        },
        "abandonment_causes": {
          "$ref": "#/$defs/abandonment_causes",
          "description": "OPTIONAL. Best-effort split of challenges_abandoned by cause, where the seller has evidence. unknown is the default, not a guess. Must sum to challenges_abandoned when that value is non-null."
        },
        "unique_payers": {
          "$ref": "#/$defs/count",
          "description": "REQUIRED. Distinct payer wallets in the window, EXCLUDING every address in declared_exclusions. Maps Utilia uniquePayerWallets."
        },
        "repeat_payers": {
          "$ref": "#/$defs/count",
          "description": "REQUIRED. Distinct non-excluded wallets with settled paid calls on at least 2 DISTINCT UTC CALENDAR DAYS within the window. Distinct days, not distinct calls: a wallet paying 50 times in one day counts 0 here. Must be <= unique_payers."
        },
        "revenue_usdc_net_of_own_wallets": {
          "type": "number",
          "minimum": 0,
          "description": "REQUIRED. Settled USDC revenue in the window, excluding payments from addresses with source_class \"self\" in declared_exclusions. Payments from prearranged or verifier wallets are real revenue and stay in, the breakdowns reveal them. Maps Utilia revenueUsdc."
        },
        "paid_retry_failures": {
          "$ref": "#/$defs/paid_retry_failures"
        },
        "paid_calls_by_source_class": {
          "$ref": "#/$defs/source_class_breakdown",
          "description": "paid_calls split by source_class. Must sum to paid_calls. REQUIRED in totals, OPTIONAL per endpoint. Maps Utilia integrationSource."
        },
        "challenges_by_source_class": {
          "$ref": "#/$defs/source_class_breakdown",
          "description": "OPTIONAL. challenges_served split by source_class. Must sum to challenges_served. Report it if you can: the distribution usually differs sharply from the paid distribution, and that difference is itself the finding."
        },
        "challenge_correlation": {
          "type": "object",
          "description": "OPTIONAL. How this seller links a 402 challenge to the payment attempt that followed it, so challenges_abandoned can be computed without treating IP or user-agent as identity. Proposed by Utilia (@utiliax402). NOTE: this is the only part of the spec that requires buyer cooperation. A seller can issue quote_id alone, but the buyer runtime must echo it on the paid retry, so expect these to read null until buyer runtimes adopt it.",
          "additionalProperties": false,
          "properties": {
            "method": {
              "type": "string",
              "enum": [
                "quote_id",
                "none"
              ],
              "description": "quote_id: the seller issues an opaque single-use token in the 402 and the buyer echoes it on the retry. none: this seller cannot correlate, and challenges_abandoned must be null."
            },
            "quote_id_issued": {
              "$ref": "#/$defs/count",
              "description": "OPTIONAL. Challenges served carrying a quote_id."
            },
            "quote_id_returned": {
              "$ref": "#/$defs/count",
              "description": "OPTIONAL. Payment attempts that echoed a quote_id back. quote_id_issued minus quote_id_returned is the abandonment, measured rather than inferred."
            },
            "median_seconds_challenge_to_attempt": {
              "type": [
                "number",
                "null"
              ],
              "minimum": 0,
              "description": "OPTIONAL. Median seconds from challenge_issued_at to paid_retry_at. A short median with a low attempt rate points at buyer runtimes failing fast. A long one points at policy or human approval gates. Different problems, different fixes."
            }
          },
          "required": [
            "method"
          ]
        }
      }
    },
    "endpoint_row": {
      "allOf": [
        {
          "$ref": "#/$defs/core_metrics"
        }
      ],
      "type": "object",
      "required": [
        "route",
        "challenges_served",
        "challenges_abandoned",
        "paid_calls",
        "unique_payers",
        "repeat_payers",
        "revenue_usdc_net_of_own_wallets",
        "paid_retry_failures"
      ],
      "unevaluatedProperties": false,
      "properties": {
        "route": {
          "type": "string",
          "pattern": "^/",
          "description": "REQUIRED. Endpoint path, e.g. \"/api/verify\". Maps Utilia route."
        },
        "method": {
          "type": "string",
          "description": "OPTIONAL. HTTP method, defaults to POST."
        },
        "price_usdc": {
          "type": "number",
          "minimum": 0,
          "description": "OPTIONAL. Current price per call in USDC. Informational: prices change, revenue is normative."
        },
        "notes": {
          "type": "string",
          "description": "OPTIONAL. Per-endpoint caveats."
        }
      }
    },
    "totals_block": {
      "allOf": [
        {
          "$ref": "#/$defs/core_metrics"
        }
      ],
      "type": "object",
      "description": "REQUIRED. Seller-level totals across all endpoints. Additive fields must equal the sum of endpoint rows. unique_payers and repeat_payers are deduplicated across endpoints, so each must be between the max of the endpoint values and their sum.",
      "required": [
        "challenges_served",
        "challenges_abandoned",
        "paid_calls",
        "unique_payers",
        "repeat_payers",
        "revenue_usdc_net_of_own_wallets",
        "paid_retry_failures",
        "paid_calls_by_source_class"
      ],
      "unevaluatedProperties": false
    },
    "exclusion": {
      "type": "object",
      "required": [
        "address",
        "source_class",
        "evidence"
      ],
      "additionalProperties": false,
      "properties": {
        "address": {
          "$ref": "#/$defs/evm_address"
        },
        "source_class": {
          "type": "string",
          "enum": [
            "self",
            "prearranged",
            "verifier",
            "scanner"
          ],
          "description": "REQUIRED. Why this wallet is excluded. organic and unknown are not valid here: you cannot exclude what you claim not to know."
        },
        "evidence": {
          "type": "string",
          "minLength": 1,
          "description": "REQUIRED. How a third party can confirm the classification: a public doc, a repo, an announcement, or a plain statement of ownership."
        },
        "label": {
          "type": "string",
          "description": "OPTIONAL. Human-readable name for the wallet."
        }
      }
    },
    "receipt_linkage": {
      "type": "object",
      "required": [
        "address",
        "chain",
        "asset"
      ],
      "additionalProperties": false,
      "description": "REQUIRED. Enough on-chain pointers that a third party can independently reconstruct the revenue claim. At least one of settlement_tx_hashes or block_range must be present. Maps Utilia receiptLinkage.",
      "properties": {
        "address": {
          "$ref": "#/$defs/evm_address",
          "description": "REQUIRED. The seller's receiving address."
        },
        "chain": {
          "type": "string",
          "minLength": 1,
          "description": "REQUIRED. CAIP-2 chain id, e.g. \"eip155:8453\" for Base.",
          "examples": [
            "eip155:8453"
          ]
        },
        "asset": {
          "type": "string",
          "minLength": 1,
          "description": "REQUIRED. Asset contract address, e.g. the USDC contract on the declared chain."
        },
        "settlement_tx_hashes": {
          "type": "array",
          "minItems": 1,
          "items": {
            "$ref": "#/$defs/tx_hash"
          },
          "description": "List of settlement transaction hashes in the window. Expected when paid_calls is small (100 or fewer). See README for why this is not always required."
        },
        "block_range": {
          "type": "object",
          "required": [
            "from",
            "to"
          ],
          "additionalProperties": false,
          "description": "Block range covering the window, for auditors to scan transfers to the receiving address.",
          "properties": {
            "from": {
              "type": "integer",
              "minimum": 0
            },
            "to": {
              "type": "integer",
              "minimum": 0
            }
          }
        }
      },
      "anyOf": [
        {
          "required": [
            "settlement_tx_hashes"
          ]
        },
        {
          "required": [
            "block_range"
          ]
        }
      ]
    }
  }
}